PK;NOMBRE;DESCRIPCION-ENTIDAD;HORARIO;EQUIPAMIENTO;TRANSPORTE;DESCRIPCION;ACCESIBILIDAD;CONTENT-URL;NOMBRE-VIA;CLASE-VIAL;TIPO-NUM;NUM;PLANTA;PUERTA;ESCALERAS;ORIENTACION;LOCALIDAD;PROVINCIA;CODIGO-POSTAL;BARRIO;DISTRITO;COORDENADA-X;COORDENADA-Y;LATITUD;LONGITUD;TELEFONO;FAX;EMAIL;TIPO;
139451;"Auditorio y sala de exposiciones Paco de Lucía (antigua Sala Latinarte)";"";" Secretaría: de 9 a 14 horas y de 16:30 a 19 horas ";"  Sala de exposiciones  Salón de actos / auditorio  ";" Metro: Aluche (línea 5)  Bus: 17, 31, 117, 121, 131, 138, 139, 155    Renfe: Aluce ";"";"1";"http://www.madrid.es/vgn-ext-templating/v/index.jsp?vgnextchannel=9e4c43db40317010VgnVCM100000dc0ca8c0RCRD&vgnextoid=6089ba61e681c010VgnVCM1000000b205a0aRCRD";"GENERAL FANJUL";"AVENIDA";"V";"2A";"";"";"";"";"MADRID";"MADRID";"28044";"LAS AGUILAS";"LATINA";"435243";"4470971";"40.38493634769686";"-3.764230286224537";"915 120 890 / 915 120 891";"";"ruizdm@madrid.es";"/contenido/entidadesYorganismos/CentrosCulturales"; 
1956;"Casa de América";" Antiguo Palacio de Linares, diseñado por Carlos Colubí en 1872. De estilo rococó, destaca la escalera de mármol de Manuel Aníbal Álvarez y toda la decoración interior. ";"";"  Celebración de actividades culturales: conciertos, conferencias, mesas redondas, actividades infantiles, exposiciones  Sala de exposiciones  Anfiteatro  Centro de información y documentación  Cine  Restauración   Restaurante Le Cabrera Casa de América, abierto todos los días de 13:30 a 15:30 y de 20:30 a 00 horas. Dispone de reservado.  Coctelería Le Cabrerita ,  abierta de lunes a domingo de 13:30 a 2 horas. Acceso por Paseo de Recoletos, 2.  Cafetería Le Cabrera Casa de América, abierta de lunes a domingo de 9 a 12 horas. Acceso por Marqués del Duero.  Terraza de verano.     La programación puede ser consultada en  http://www.casamerica.es/  ";" Metro: Banco de España (línea 2)  Bus: 1, 2, 5, 9, 10, 14, 15, 20, 27, 34, 37, 45, 51, 52, 53, 74, 146, 150, 202  Renfe: Recoletos ";"  Horario :    Exposiciones  (Salas Frida Khalo y Diego Rivera).Entrada por Marqués del Duero, 2.   Lunes a viernes: de 11 a 19:30 h.  Sábados: de 11 a 15 horas. Domingos cerrado.      Punto de información (plaza de Cibeles, 2):  de lunes a viernes de 9 a 15 horas y de 16 a 20:30 horas   Sala de proyecciones (Cine Iberia):  programación regular de miércoles a sábados a las 20 horas (las sesiones anunciadas pueden sufrir cambios). Proyecciones extraordinarias los lunes y martes   Taquilla:    De lunes a viernes de 10 a 15 horas y de 16 a 20 horas en el punto de información.  Desde las 20 horas en el Cine Iberia.  Sábados, domingos y festivos desde las 19 horas.  Agosto de miércoles a sábados de 19 a 20 horas.     Restaurante Le Cabrera Casa de América:  abierto todos los días de 13:30 a 15:30 horas y de 20:30 a 00 horas   Visitas guiadas Palacio de Linares.  Duración: 1 hora. Comienzan cada hora en punto. Solo visitas en grupo con un mínimo 10 y un máximo 20 personas. Antes de comenzar el recorrido se proyecta un vídeo de 8 minutos de duración. Las visitas se hacen en inglés, español y grupos mixtos. Horarios: sábados y domingos a las 11, 12 y 13 horas. No hay visitas los días 3 de mayo, 4, 5, 11 y 12 de octubre ni durante el mes de agosto.  ";"1";"http://www.madrid.es/vgn-ext-templating/v/index.jsp?vgnextchannel=9e4c43db40317010VgnVCM100000dc0ca8c0RCRD&vgnextoid=10f979262ef5d010VgnVCM1000000b205a0aRCRD";"CIBELES";"PLAZA";"V";"4";"";"";"";"";"MADRID";"MADRID";"28014";"RECOLETOS";"SALAMANCA";"441379";"4474785";"40.419749969504096";"-3.6922961903054348";"915 954 800 (información) / 915 775 955 (reservas para el restaurante)";"";"";"/contenido/entidadesYorganismos/Consorcios"; 
7320916;"Casa de la Juventud de Arganzuela";"";"";" 3 despachos de atención al público ";" Metro: Legazpi (líneas 3, 6), Pirámides (línea 5)   Bus: 6, 8, 18, 19, 45, 47, 59, 78, 85, 86, 148, 62 ";"";"0";"http://www.madrid.es/vgn-ext-templating/v/index.jsp?vgnextchannel=9e4c43db40317010VgnVCM100000dc0ca8c0RCRD&vgnextoid=84701c2830b14410VgnVCM1000000b205a0aRCRD";"CHOPERA";"PASEO";"V";"10";"";"";"";"";"MADRID";"MADRID";"28045";"CHOPERA";"ARGANZUELA";"440824";"4471863";"40.39339679324264";"-3.698565725754662";"915 132 661                    
";"";"";"/contenido/entidadesYorganismos/CentrosCulturales"; 
4605237;"Centro Casa Asia - Madrid";"";"";" Organización de cursos relacionados con la cultura y lenguas asiáticas ";" Bus: 3, 148, L3 ";"";"0";"http://www.madrid.es/vgn-ext-templating/v/index.jsp?vgnextchannel=9e4c43db40317010VgnVCM100000dc0ca8c0RCRD&vgnextoid=1baf0c4d68263110VgnVCM2000000c205a0aRCRD";"MAYOR";"CALLE";"V";"69";"1ª";"";"";"PALACIO DE CAÑETE";"MADRID";"MADRID";"28013";"PALACIO";"CENTRO";"439768";"4474305";"40.41531064853993";"-3.7112390711768444";"913 896 100             
";"913 694 909";"casaasia@casaasia.es";"/contenido/entidadesYorganismos/CentrosCulturales"; 
1916;"Centro Conde Duque";" Centro Conde Duque es un espacio cultural vinculado a la memoria y a la la difusión de Madrid.  Entre sus fines se encuentran: la difusión de la historia de Madrid, el intercambio de conocimientos históricos con la sociedad, la conservación de  los fondos históricos y artísticos del Ayuntamiento y la producción y exhibición de manifestaciones artísticas relacionadas con el mundo de la escena y de la música. ";"  Exposiciones (entrada gratuita)    De martes a sábado de 10 a 14 y de 17:30 a 21 horas.  Domingos y festivos de 10:30 a 14 horas.  ";"   Salas de Exposiciones:  espacios expositivos con más de mil quinientos metros cuadrados, caracterizada por sus muros de ladrillo y por los espacios abovedados.   Auditorio Conde Duque:  1300 metros cuadrados, renovados en el 2011.   Teatro Conde Duque : espacio escénico moderno y versátil, con una escena de 12 por 17 metros de superficie y un peine de 5,99 metros de altura. Cuenta, además, con dos grandes salas de ensayo adyacentes.    Salon de Actos: u na gran sala de doble altura, totalmente forrada de madera, que está preparada para la realización de conferencias, presentaciones, congresos y seminarios. Ocupa las plantas primera y segunda de la zona del edificio que se sitúa encima del vestíbulo general desde el que tiene acceso. Dotado de medios de audición y gran pantalla de proyección, dispone de una capacidad de 293 asientos.     Zona wifi .   ";" Metro: Ventura Rodríguez (línea 3), San Bernardo (línea 2 y 4) y Noviciado (línea 2).  Bus: 1, 2, 44, 74, 133, 202, 749, Minibús M-2 ";"  Teatro, Auditorio     Venta de entradas:   www.entradas.com   y taquilla del recinto  Contacto: 917 220 573 (de lunes a viernes de 10 a 14:30 horas y de 16 a 17 horas)  Correo electrónico:  actividades@condeduquemadrid.es     Salón de actos, Salas de ensayo y Eventos    Contacto: 917 220 573 (de lunes a viernes de 10 a 14:30 horas y de 16 a 17 horas)  Correo electrónico:  actividades@condeduquemadrid.es     Exposiciones: entrada gratuita    Contacto: 914 800 401  Correo electrónico:  cdinfoexposiciones@madrid.es   ";"1";"http://www.madrid.es/vgn-ext-templating/v/index.jsp?vgnextchannel=9e4c43db40317010VgnVCM100000dc0ca8c0RCRD&vgnextoid=64463d0b5e71c010VgnVCM1000000b205a0aRCRD";"CONDE DUQUE";"CALLE";"V";"9 - 11";"";"";"";"";"MADRID";"MADRID";"28015";"UNIVERSIDAD";"CENTRO";"439864";"4475706";"40.427938443518215";"-3.710240346719518";"";"";"";"/contenido/entidadesYorganismos/MonumentosEdificiosArtisticos"; 
117288;"Centro Cultural Agustín Díaz (Moncloa - Aravaca)";"";" Secretaría: de lunes a viernes de 9 a 14 y de 16:30 a 21 horas. ";"  5 aulas  Zona wifi  ";" Bus: 41, 75 ";"";"1";"http://www.madrid.es/vgn-ext-templating/v/index.jsp?vgnextchannel=9e4c43db40317010VgnVCM100000dc0ca8c0RCRD&vgnextoid=2d07cbf06c81c010VgnVCM1000000b205a0aRCRD";"COMANDANTE FORTEA";"PASEO";"V";"42";"";"";"";"";"MADRID";"MADRID";"28008";"CASA DE CAMPO";"MONCLOA-ARAVACA";"437982";"4475676";"40.427538776051804";"-3.732422725110936";"915 487 772 / 773 / 774 ";"";"gonzalezrem@madrid.es";"/contenido/entidadesYorganismos/CentrosCulturales"; 
118067;"Centro Cultural Alfredo Kraus (Fuencarral - El Pardo)";"";"Secretaría: de lunes a jueves de 9:30  a 14 y de 16 a 18. Viernes de 9:30 a 14 horas.";"  Sala de exposiciones  Sala de lectura y estudio  2 salones de actos / auditorio  14 aulas  Cafetería  Zona wifi  ";" Bus: 49 , 64 ";"";"1";"http://www.madrid.es/vgn-ext-templating/v/index.jsp?vgnextchannel=9e4c43db40317010VgnVCM100000dc0ca8c0RCRD&vgnextoid=7337cbf06c81c010VgnVCM1000000b205a0aRCRD";"PRADERA DE VAQUERIZAS";"GLORIETA";"V";"9";"";"";"";"";"MADRID";"MADRID";"28035";"MIRASIERRA";"FUENCARRAL-EL PARDO";"438957";"4482694";"40.49082275610172";"-3.7216054330053647";"913 767 085";"";"ccakraus@madrid.es";"/contenido/entidadesYorganismos/CentrosCulturales"; 
1990;"Centro Cultural Almirante Churruca (Latina)";"";" Secretaría: de lunes a viernes de 9 a 14 y de 16,30 a 19 horas.  ";"  Sala de exposiciones  Sala de lectura/estudio  Salón de actos/auditorio  10 Aulas  Zona wifi  ";" Metro: Aviación Española (línea 10)  Bus: 17, 34, 39, 139  Renfe: Las Águilas ";"";"1";"http://www.madrid.es/vgn-ext-templating/v/index.jsp?vgnextchannel=9e4c43db40317010VgnVCM100000dc0ca8c0RCRD&vgnextoid=76c43d0b5e71c010VgnVCM1000000b205a0aRCRD";"FUENTE DEL TIRO";"CALLE";"V";"72";"";"";"";"";"MADRID";"MADRID";"28024";"LAS AGUILAS";"LATINA";"433895";"4470766";"40.3829835905706";"-3.7800890564106613";"915 090 581 / 917 053 794";"";"ccchurruca@madrid.es";"/contenido/entidadesYorganismos/CentrosCulturales"; 
1942;"Centro Cultural Antonio Machado (San Blas - Canillejas)";"";" Secretaría: de lunes a viernes de 10 a 13:45 y de 17 a 18:45 horas.  ";"  5 salas de exposiciones  2 salones de actos / auditorio  18 aulas  Zona wifi  ";"Bus: 4, 106, 140";"";"0";"http://www.madrid.es/vgn-ext-templating/v/index.jsp?vgnextchannel=9e4c43db40317010VgnVCM100000dc0ca8c0RCRD&vgnextoid=cce43d0b5e71c010VgnVCM1000000b205a0aRCRD";"SAN ROMAN DEL VALLE";"CALLE";"V";"8";"";"";"";"";"MADRID";"MADRID";"28037";"ARCOS";"SAN BLAS-CANILLEJAS";"447365";"4474799";"40.42027705095574";"-3.621741078700336";"913 135 294 ";"";"ccamachado@madrid.es";"/contenido/entidadesYorganismos/CentrosCulturales"; 
1919;"Centro Cultural Aravaca (Moncloa - Aravaca)";"";" Secretaría: de lunes a viernes de 10 a 13:30 horas. Lunes y martes de 18 a 20 horas ";"  8 aulas  Zona wifi  ";"Bus: 160, 161";"";"1";"http://www.madrid.es/vgn-ext-templating/v/index.jsp?vgnextchannel=9e4c43db40317010VgnVCM100000dc0ca8c0RCRD&vgnextoid=13153d0b5e71c010VgnVCM1000000b205a0aRCRD";"ZARZA";"CALLE";"V";"20";"";"";"";"";"MADRID";"MADRID";"28023";"ARAVACA";"MONCLOA-ARAVACA";"433479";"4479145";"40.45843103553325";"-3.785855667139094";"917 400 882 / 883";"";"ccaravaca@madrid.es";"/contenido/entidadesYorganismos/CentrosCulturales"; 
52511;"Centro Cultural Auditorio Parque El Paraiso (San Blas - Canillejas)";"";"";"";" Metro: Simancas (línea 7).  Bus: 4, 38, 48, 70, 109. ";"";"0";"http://www.madrid.es/vgn-ext-templating/v/index.jsp?vgnextchannel=9e4c43db40317010VgnVCM100000dc0ca8c0RCRD&vgnextoid=a395946be351c010VgnVCM2000000c205a0aRCRD";"ARCENTALES";"AVENIDA";"V";"4";"";"";"";"";"MADRID";"MADRID";"28037";"HELLIN";"SAN BLAS-CANILLEJAS";"447335";"4475875";"40.42996840999023";"-3.622184001035289";"915 888 065 ";"";"cultusanblas@madrid.es";"/contenido/entidadesYorganismos/AuditoriosSalasConcierto"; 
64851;"Centro Cultural Buenavista (Salamanca)";"";" Secretaría: de 9 a 13 horas y de 16 a 18 horas de lunes a jueves. Viernes de 9 a 13 horas. ";"  1 sala de exposiciones  1 sala de lectura y estudio  1 salón de actos / auditorio   8 aulas (incluyendo gimnasios)  Zona Wifi  ";" Metro: Diego de León (líneas 4 , 5 , 6)  Bus: 1, 12, 48, 74 ";"";"1";"http://www.madrid.es/vgn-ext-templating/v/index.jsp?vgnextchannel=9e4c43db40317010VgnVCM100000dc0ca8c0RCRD&vgnextoid=068e598d1351c010VgnVCM1000000b205a0aRCRD";"TOREROS";"AVENIDA";"V";"5";"";"";"";"";"MADRID";"MADRID";"28028";"GUINDALERA";"SALAMANCA";"443202";"4476130";"40.43200210571468";"-3.6709293330780204";"917 240 800 / 917 240 802";"";"ccbuenavista@madrid.es";"/contenido/entidadesYorganismos/CentrosCulturales"; 
1943;"Centro Cultural Buero Vallejo (San Blas - Canillejas)";"";" Secretaría: de lunes a viernes de 9:30 a 13:30 y de 16 a 18 horas.  ";"  Sala de exposiciones  Salón de actos / auditorio  8 aulas  Zona wifi  ";" Metro: Torres Arias (línea 5)  Bus: 77  ";"";"0";"http://www.madrid.es/vgn-ext-templating/v/index.jsp?vgnextchannel=9e4c43db40317010VgnVCM100000dc0ca8c0RCRD&vgnextoid=98953d0b5e71c010VgnVCM1000000b205a0aRCRD";"BOLTA&Ntilde;A";"CALLE";"V";"26";"";"";"";"";"MADRID";"MADRID";"28022";"CANILLEJAS";"SAN BLAS-CANILLEJAS";"448133";"4477512";"40.44477474902185";"-3.6129105844633775";"917 411 182";"";"ccbvallejo@madrid.es";"/contenido/entidadesYorganismos/CentrosCulturales"; 
118317;"Centro Cultural Carril del Conde (Hortaleza)";"";" Secretaría (atención al público): de 9 a 14 horas ";"  Zona wifi  ";" Metro: Arturo Soria (línea 4)  Bus: 9, 72, 73 ";"  Sala de exposiciones  Sala de lectura y estudio  Salón de actos / auditorio  9 aulas  ";"1";"http://www.madrid.es/vgn-ext-templating/v/index.jsp?vgnextchannel=9e4c43db40317010VgnVCM100000dc0ca8c0RCRD&vgnextoid=66a7cbf06c81c010VgnVCM1000000b205a0aRCRD";"CARRIL DEL CONDE";"CALLE";"V";"57";"";"";"";"";"MADRID";"MADRID";"28043";"CANILLAS";"HORTALEZA";"444625";"4479327";"40.46088953531134";"-3.6544210187969433";"917 161 240 / 917 161 242                        
";"";"cccarrilconde@madrid.es";"/contenido/entidadesYorganismos/CentrosCulturales"; 
1945;"Centro Cultural Casa de Vacas (Retiro)";"";" De lunes a domingo de 10 a 21 horas. ";"  Sala de exposiciones  Salón de actos / auditorio  Zona Wifi  ";" Metro: Retiro (línea 2)  Bus: 2, 20, 28, 202 ";"";"0";"http://www.madrid.es/vgn-ext-templating/v/index.jsp?vgnextchannel=9e4c43db40317010VgnVCM100000dc0ca8c0RCRD&vgnextoid=35e53d0b5e71c010VgnVCM1000000b205a0aRCRD";"COLOMBIA";"PASEO";"V";"1";"";"";"";"";"MADRID";"MADRID";"28009";"LOS JERONIMOS";"RETIRO";"442077";"4474703";"40.41906024374356";"-3.6840615387926956";"914 095 819 / 914 092 336              
";"";"cccasadevacas@madrid.es";"/contenido/entidadesYorganismos/SalasExposiciones"; 
1925;"Centro Cultural Casa del Reloj (Arganzuela)";"";" Secretaría: de lunes a viernes de 10 a 13 y de 17 a 19 horas (talleres). ";"  2 Salas de exposiciones  Salón de actos / auditorio  14 Aulas  Cafetería  ";" Metro: Legazpi (líneas 3, 6)  Bus: 6, 18, 62, 78, 148 ";"";"0";"http://www.madrid.es/vgn-ext-templating/v/index.jsp?vgnextchannel=9e4c43db40317010VgnVCM100000dc0ca8c0RCRD&vgnextoid=8b063d0b5e71c010VgnVCM1000000b205a0aRCRD";"CHOPERA";"PASEO";"V";"6 y 10";"";"";"";"";"MADRID";"MADRID";"28045";"CHOPERA";"ARGANZUELA";"440695";"4471989";"40.394522745106734";"-3.7000855961559855";"915 886 290 / 6299 /6118 / 6207 ";"";"crelojarganzuela@madrid.es";"/contenido/entidadesYorganismos/CentrosCulturales"; 
4551096;"Centro Cultural Ciudad Pegaso (San Blas - Canillejas)";"";" Secretaría: de lunes a viernes de 10 a 13:30 y de 16:30 a 19 horas. ";"  Salas de exposiciones  Sala de lectura y estudio  Salón de actos / auditorio  13 aulas  Zona wifi  ";"Bus :  77 ";"";"0";"http://www.madrid.es/vgn-ext-templating/v/index.jsp?vgnextchannel=9e4c43db40317010VgnVCM100000dc0ca8c0RCRD&vgnextoid=07f63190712b1110VgnVCM1000000b205a0aRCRD";"SEPTIMA";"AVENIDA";"V";"11";"";"";"";"";"MADRID";"MADRID";"28022";"REJAS";"SAN BLAS-CANILLEJAS";"449391";"4477910";"40.448428925762634";"-3.5980969888187393";"913 209 770";"";"cccpegaso@madrid.es";"/contenido/entidadesYorganismos/CentrosCulturales"; 
80143;"Centro Cultural Dotacional Integrado Arganzuela";"";" Secretaría: de lunes a viernes de 9 a 13 y de 17 a 19 horas ";"  Equipamientos    Sala de exposiciones  Sala de lectura y estudio  Salón de actos / auditorio  2 salas de ensayo  8 aulas  Cafetería  Zona wifi    Servicios    Actividades de ocio y tiempo libre  Convivencia familiar y social   Atención psicosocial  ";" Metro: Palos de la Frontera (línea 3)  Bus: 6, 8, 19, 45, 47, 55, 59, 85, 86, 102, 247  Renfe: Delicias ";"";"1";"http://www.madrid.es/vgn-ext-templating/v/index.jsp?vgnextchannel=9e4c43db40317010VgnVCM100000dc0ca8c0RCRD&vgnextoid=f9ea79262ef5d010VgnVCM1000000b205a0aRCRD";"CANARIAS";"CALLE";"V";"17";"";"";"";"";"MADRID";"MADRID";"28045";"PALOS DE MOGUER";"ARGANZUELA";"441089";"4472825";"40.40207279862862";"-3.6955325387824014";"915 063 610";"";"cdiarganzuela@madrid.es";"/contenido/entidadesYorganismos/CentrosCulturales"; 
5498725;"Centro Cultural Eduardo Úrculo (Tetuán)";"";" Secretaría: de lunes a viernes de 9:30 a 13:30 y de lunes a jueves 17 a 18:30 horas. ";"  2 salas de exposiciones  1 Salón de actos / auditorio  4 salas de ensayo  9 aulas  Zona wifi  ";" Metro: Ventilla (línea 9)  Bus: 42 ";"En la misma sede está ubicada la Sala de Estudio Eduardo Úrculo. ";"1";"http://www.madrid.es/vgn-ext-templating/v/index.jsp?vgnextchannel=9e4c43db40317010VgnVCM100000dc0ca8c0RCRD&vgnextoid=f8f9338588355210VgnVCM1000000b205a0aRCRD";"DONOSO";"PLAZA";"V";"5";"";"";"";"";"MADRID";"MADRID";"28029";"ALMENARA";"TETUAN";"440967";"4480259";"40.46903299144094";"-3.6976620067964996";"917 337 249, 913 239 740";"";"cceurculo@madrid.es";"/contenido/entidadesYorganismos/CentrosCulturales"; 
1953;"Centro Cultural el Madroño (Vicálvaro)";"";"Secretaría: de lunes a viernes de 9 a 14 horas.";"  Sala de exposiciones  Sala de lectura y estudio  Salón de actos / Auditorio  7 aulas  Zona wifi  ";" Metro: Vicálvaro (línea 9)  Bus: 4, 100, 106, 130 ";"";"0";"http://www.madrid.es/vgn-ext-templating/v/index.jsp?vgnextchannel=9e4c43db40317010VgnVCM100000dc0ca8c0RCRD&vgnextoid=57b63d0b5e71c010VgnVCM1000000b205a0aRCRD";"VILLARDONDIEGO";"CALLE";"V";"36";"";"";"";"";"MADRID";"MADRID";"28032";"CASCO H.VICALVARO";"VICALVARO";"448466";"4473127";"40.405283650744316";"-3.6086278232922804";"917 753 140 /  917 753 141              
";"";"ccelmadrono@madrid.es";"/contenido/entidadesYorganismos/CentrosCulturales"; 
1939;"Centro Cultural El Pozo (Puente de Vallecas)";"";" Secretaría: de lunes a viernes de 9 a 14 y de 17 a 19 horas. ";"  2 salas de exposiciones  2 salas de lectura y estudio  Salón de actos / auditorio  2 salas de ensayo  12 aulas  Cafetería  Zona wifi  ";" Bus: 24, 102 ";"";"1";"http://www.madrid.es/vgn-ext-templating/v/index.jsp?vgnextchannel=9e4c43db40317010VgnVCM100000dc0ca8c0RCRD&vgnextoid=add63d0b5e71c010VgnVCM1000000b205a0aRCRD";"GLORIETAS";"AVENIDA";"V";"19 - 21";"";"";"";"";"MADRID";"MADRID";"28053";"ENTREVIAS";"PUENTE DE VALLECAS";"444059";"4469640";"40.3735856436473";"-3.6602546064905397";"917 866 372 / 917 866 644";"";"ccptioraimundo@madrid.es";"/contenido/entidadesYorganismos/CentrosCulturales"; 
1940;"Centro Cultural el Torito (Moratalaz)";"";" Secretaría:    De lunes a viernes de 9 a 14 y de 17 a 19 horas   Sábados y domingos cerrado  Agosto cerrado  ";"  Sala de lectura y estudio  Salón de actos / auditorio  9 aulas  Zona wifi  ";" Metro: Artilleros (línea 9)  Bus: 20, 30, 32, 71, 100 ";"";"0";"http://www.madrid.es/vgn-ext-templating/v/index.jsp?vgnextchannel=9e4c43db40317010VgnVCM100000dc0ca8c0RCRD&vgnextoid=f3073d0b5e71c010VgnVCM1000000b205a0aRCRD";"MORATALAZ";"AVENIDA";"V";"130";"";"";"";"";"MADRID";"MADRID";"28030";"VINATEROS";"MORATALAZ";"445250";"4473240";"40.40609591857167";"-3.646536107063507";"913 287 385 / 913 287 386";"";"cceltorito@madrid.es";"/contenido/entidadesYorganismos/CentrosCulturales"; 
1931;"Centro Cultural Federico Chueca (Hortaleza)";"";" Secretaría (atención al público): de 9 a 14 horas. ";"  Salón de actos / auditorio  3 aulas  ";" Bus: 72, 73, 87 ";"";"1";"http://www.madrid.es/vgn-ext-templating/v/index.jsp?vgnextchannel=9e4c43db40317010VgnVCM100000dc0ca8c0RCRD&vgnextoid=90573d0b5e71c010VgnVCM1000000b205a0aRCRD";"BENITA AVILA";"CALLE";"V";"17";"";"";"";"";"MADRID";"MADRID";"28043";"CANILLAS";"HORTALEZA";"444956";"4479779";"40.46498334634005";"-3.650568266584691";"913 000 389";"";"ccfchueca@madrid.es";"/contenido/entidadesYorganismos/CentrosCulturales"; 
1954;"Centro Cultural Fernando de los Ríos (Latina)";"";" Secretaría: de lunes a viernes de 9 a 14 y de 16 a 18:30 horas ";"  Sala de exposiciones  2 salas de lectura/estudio  Salón de actos / auditorio  11 aulas  Cafetería  Zona wifi  ";"Bus: 25, 31, 121, 138";"  En la misma sede:    Biblioteca Pública Municipal de Aluche   Sala de Estudio Fernando de los Ríos   ";"1";"http://www.madrid.es/vgn-ext-templating/v/index.jsp?vgnextchannel=9e4c43db40317010VgnVCM100000dc0ca8c0RCRD&vgnextoid=3d973d0b5e71c010VgnVCM1000000b205a0aRCRD";"CAMARENA";"CALLE";"V";"10B";"";"";"";"";"MADRID";"MADRID";"28047";"ALUCHE";"LATINA";"435929";"4472140";"40.39552030374428";"-3.7562666456453653";"917 198 993 / 917 198 930";"";"ccfrios#@madrid.es";"/contenido/entidadesYorganismos/CentrosCulturales"; 
4703628;"Centro Cultural Fernando Lázaro Carreter (Carabanchel)";"";" Secretaría: de lunes a viernes de 9:30 a 14 horas y de 16:30 a 19:30 horas. ";"  Sala de exposiciones  Sala de lectura y estudio  Salón de actos / auditorio  7 aulas  3 gimnasios  Cafetería   ";" Bus: 55, 60, 116 ";"";"1";"http://www.madrid.es/vgn-ext-templating/v/index.jsp?vgnextchannel=9e4c43db40317010VgnVCM100000dc0ca8c0RCRD&vgnextoid=340ed2d6fe9a6110VgnVCM1000000b205a0aRCRD";"VERDAD";"CALLE";"V";"29";"";"";"";"";"MADRID";"MADRID";"28019";"OPAÑEL";"CARABANCHEL";"439245";"4471670";"40.391436091094086";"-3.7171618764739933";"914 690 895               
";"";"cclazarocarreter@act-educo.com";"/contenido/entidadesYorganismos/CentrosCulturales"; 
1921;"Centro Cultural Galileo (Chamberí)";"";"  Centro    De lunes  a viernes de 8:30 a 21:30 horas  Sábados de 10 a 20:30 horas.  Domingo y festivos: cerrado     Secretaría    De lunes a viernes 10 a 13 horas  Lunes y jueves de 16 a 17:30 horas    Sala exposiciones    De lunes a sábado de 10 a 14 y de 15 a 20 horas.  ";"  Espacios    Teatro Galileo  Auditorio    Servicios    2 Salas de exposiciones  1 Salas de lectura y estudio  1 Salón de actos / Auditorio  14 Aulas  Cafetería  Zona wifi  ";" Bus: 2, 16, 61, 202 ";"";"1";"http://www.madrid.es/vgn-ext-templating/v/index.jsp?vgnextchannel=9e4c43db40317010VgnVCM100000dc0ca8c0RCRD&vgnextoid=30181e79ee71c010VgnVCM1000000b205a0aRCRD";"GALILEO";"CALLE";"V";"39";"";"";"";"";"MADRID";"MADRID";"28015";"ARAPILES";"CHAMBERI";"439851";"4476347";"40.43371190964793";"-3.7104543597957758";"915 913 901";"";"ccgalileo@madrid.es";"/contenido/entidadesYorganismos/CentrosCulturales"; 
70243;"Centro Cultural Gloria Fuertes (Barajas)";"";" Secretaría: de lunes a viernes de 10 a 14 y de 16 a 19 horas. ";"  Sala de exposiciones  5 aulas  Cafetería  Zona wifi  ";" Bus: 105, 112, 115, 151. ";"";"1";"http://www.madrid.es/vgn-ext-templating/v/index.jsp?vgnextchannel=9e4c43db40317010VgnVCM100000dc0ca8c0RCRD&vgnextoid=2e5068540e41c010VgnVCM2000000c205a0aRCRD";"LOGROÑO";"AVENIDA";"V";"179";"";"";"";"";"MADRID";"MADRID";"28042";"CORRALEJOS";"BARAJAS";"449775";"4479261";"40.460622835379624";"-3.5936877657335935";"913 120 243";"";"ccgloriafuertes@madrid.es";"/contenido/entidadesYorganismos/CentrosCulturales"; 
1930;"Centro Cultural Hortaleza";"";" Secretaría (atención al público): de 9 a 14 horas ";"  Sala de exposiciones  Sala de lectura y estudio  Salón de actos / auditorio  4 salas de ensayo  5 aulas  Zona wifi  ";" Metro: Parque de Santa María (línea 4)  Bus: 72, 87, 107 ";"";"1";"http://www.madrid.es/vgn-ext-templating/v/index.jsp?vgnextchannel=9e4c43db40317010VgnVCM100000dc0ca8c0RCRD&vgnextoid=86381e79ee71c010VgnVCM1000000b205a0aRCRD";"SANTA VIRGILIA";"CALLE";"V";"15";"";"";"";"";"MADRID";"MADRID";"28033";"PINAR DEL REY";"HORTALEZA";"445689";"4481092";"40.476859845869534";"-3.6420353342333227";"913 821 493";"";"cchortaleza@madrid.es";"/contenido/entidadesYorganismos/CentrosCulturales"; 
1929;"Centro Cultural Huerta de la Salud (Hortaleza)";"";" Secretaría (atención al público): de 9 a 14 horas ";"  Salón de actos / Auditorio  3 aulas  Zona wifi  ";" Metro: San Lorenzo (línea 4)  Bus: 9, 72, 87, 107 ";"";"1";"http://www.madrid.es/vgn-ext-templating/v/index.jsp?vgnextchannel=9e4c43db40317010VgnVCM100000dc0ca8c0RCRD&vgnextoid=dc581e79ee71c010VgnVCM1000000b205a0aRCRD";"MAR DE ARAL";"CALLE";"V";"13 posterior";"";"";"";"";"MADRID";"MADRID";"28033";"PINAR DEL REY";"HORTALEZA";"445599";"4480837";"40.4745567778344";"-3.6430751341515526";"913 825 104";"";"cchuertasalud@madrid.es";"/contenido/entidadesYorganismos/CentrosCulturales"; 
142944;"Centro Cultural Jose Luis Sampedro (Latina) (antiguo Centro Cultural Lucero)";"";" Secretaría: de lunes a viernes de 9 a 14:30 horas y de 16 a 18 horas ";"  4 salas de ensayos  Sala de exposiciones  Sala de lectura y estudio  Salón de actos / auditorio  6 aulas  Zona wifi  ";" Metro: Laguna (línea 6)  Bus: 55, 119, 138  Renfe: Laguna ";"En la misma sede está ubicada la Sala de Estudio Lucero. ";"1";"http://www.madrid.es/vgn-ext-templating/v/index.jsp?vgnextchannel=9e4c43db40317010VgnVCM100000dc0ca8c0RCRD&vgnextoid=bd3fba61e681c010VgnVCM1000000b205a0aRCRD";"CASTROSERNA";"CALLE";"V";"4B";"";"";"";"esquina Calle Latina";"MADRID";"MADRID";"28047";"LUCERO";"LATINA";"436542";"4472809";"40.40159394334669";"-3.749110841406562";"915 267 820 / 821";"";"cclucero@madrid.es";"/contenido/entidadesYorganismos/CentrosCulturales"; 
